"","Inicio","Classificador","UF","Credor","tipo_credor","Projeto","honras","data","Moeda","valor","data_date"
"140","Ceara","Estados","CE","BIRD","Organismos Multilaterais","Projeto de Desenvolvimento Rural Sustentável - Projeto São José III",NA,"03/10/2012","USD",1e+08,2012-10-03
"141","Ceara","Estados","CE","BID","Organismos Multilaterais","Programa Nacional de Desenvolvimento do Turismo - Prodetur Nacional",NA,"25/11/2010","USD",1.5e+08,2010-11-25
"142","Ceara","Estados","CE","BNDES","Bancos Federais","Programas de Desenvolvimento Integrado Constantes do PPA. Descontingenciamento de Crédito - Resolução CMN nº 3.794, de 07/10/2009",NA,"11/06/2010","R$",440214000,2010-06-11
"143","Ceara","Estados","CE","BID","Organismos Multilaterais","Programa de Expansão e Melhoria da Assistência Especializada Saúde",NA,"22/12/2009","USD",7.7e+07,2009-12-22
"144","Ceara","Estados","CE","BID","Organismos Multilaterais","Programa Rodoviário - Ceará III",NA,"22/12/2009","USD",158620000,2009-12-22
"145","Ceara","Estados","CE","BID","Organismos Multilaterais","Programa de Apoio às Reformas Sociais do Ceará - PROARES",NA,"22/12/2009","USD",4.5e+07,2009-12-22
"146","Ceara","Estados","CE","BIRD","Organismos Multilaterais","Projeto de Desenvolvimento Econômico Regional do Ceará - Cidades do Ceará - Cariri Central",NA,"22/12/2009","USD",4.6e+07,2009-12-22
"147","Ceara","Estados","CE","BIRD","Organismos Multilaterais","Projeto de Gestão Integrada dos Recursos Hídricos - PROGERIR II",NA,"22/09/2009","USD",1.03e+08,2009-09-22
"148","Ceara","Estados","CE","BID","Organismos Multilaterais","Programa de Modernização Fiscal do Estado do Ceará",NA,"20/05/2009","USD",4.1e+07,2009-05-20
"149","Ceara","Estados","CE","BIRD","Organismos Multilaterais","Projeto de Apoio à Inclusão Social e ao Desenvolvimento Econômico - SWAP II",NA,"19/03/2009","USD",2.4e+08,2009-03-19
"150","Ceara","Estados","CE","BIRD","Organismos Multilaterais","Adicional do Projeto de Combate à Pobreza Rural - PCPR II",NA,"07/07/2006","USD",37500000,2006-07-07
"151","Ceara","Estados","CE","KFW","Agências Governamentais","Programa de Saneamento Básico - Ceará II",NA,"07/12/2005","EUR",8691961.98,2005-12-07
"152","Ceara","Estados","CE","BNB","Bancos Federais","Programa de Desenvolvimento do Turismo no Nordeste - PRODETUR/NE - II",NA,"20/10/2005","R$",85457059.71,2005-10-20
"153","Ceara","Estados","CE","BIRD","Organismos Multilaterais","Projeto de Apoio à Inclusão Social",NA,"18/10/2005","USD",149750000,2005-10-18
"154","Ceara","Estados","CE","BNB","Bancos Federais","Programa de Desenvolvimento do Turismo no Nordeste - PRODETUR/NE - II",NA,"25/08/2005","R$",52973098.52,2005-08-25
"155","Ceara","Estados","CE","BNB","Bancos Federais","Prodetur I",NA,"04/07/2002","R$",14112675.58,2002-07-04
"156","Ceara","Estados","CE","BID","Organismos Multilaterais","A definir",NA,"19/12/1997","USD",1.15e+08,1997-12-19
"157","Ceara","Estados","CE","JICA","Agências Governamentais","Projeto de Construção de Usinas Eólicas",NA,"01/08/1997","JPY",5.242e+09,1997-08-01
"158","Ceara","Estados","CE","BID","Organismos Multilaterais","Programa de Apoio às Reformas Sociais para o Desenvolvimento de Crianças e Adolescentes",NA,"21/05/1997","USD",4.2e+07,1997-05-21
"159","Ceara","Estados","CE","BID","Organismos Multilaterais","A definir.",NA,"09/12/1992","USD",159300000,1992-12-09
"160","Ceara","Estados","CE","BID","Organismos Multilaterais","A definir",NA,"09/12/1992","USD",39900000,1992-12-09
"161","Distrito Federal","Estados","DF","BB","Bancos Federais","Programa de Infraestrutura Urbana e Social. Lei nº 5.731, de 07/11/2016",NA,"29/12/2016","R$",6e+08,2016-12-29
"162","Distrito Federal","Estados","DF","BID","Organismos Multilaterais","Programa de Desenvolvimento Fazendário do Distrito Federal - PRODEFAZ/PROFISCO",NA,"29/02/2016","USD",31997000,2016-02-29
"163","Distrito Federal","Estados","DF","BB","Bancos Federais","Programas Asfalto Novo, Calçada Nova e Implantação de Ciclovias. Lei nº 5.394, de 27/08/2014",NA,"29/01/2015","R$",5e+08,2015-01-29
"164","Distrito Federal","Estados","DF","BID","Organismos Multilaterais","Programa de Desenvolvimento Econômico do Distrito Federal - ADEs(PROCIDADES)- GDF",NA,"10/09/2014","USD",5e+07,2014-09-10
"165","Distrito Federal","Estados","DF","BB","Bancos Federais","Contrapartidas das Obras do Programa de Aceleração do Crescimento (PAC), do Programa Minha Casa Minha Vida (PMCMV) e dos projetos de mobilidade urbana diretamente associados à Copa de 2014. Lei nº 5.001, de 20/12/2012",NA,"29/08/2014","R$",67786728.82,2014-08-29
"166","Distrito Federal","Estados","DF","BNDES","Bancos Federais","PROINVESTE - Programa de Apoio ao Investimento dos Estados e do Distrito Federal. Lei nº 5.002, de 20/12/2012",NA,"31/01/2013","R$",311152640.6,2013-01-31
"167","Distrito Federal","Estados","DF","BIRD","Organismos Multilaterais","Programa de Modernização da Gestão Pública - Gestão GDF",NA,"10/09/2009","USD",1.3e+08,2009-09-10
"168","Distrito Federal","Estados","DF","BID","Organismos Multilaterais","Programa de Transporte Urbano do Distrito Federal",NA,"30/01/2008","USD",176775000,2008-01-30
"169","Distrito Federal","Estados","DF","BIRD","Organismos Multilaterais","Programa Brasília Sustentável",NA,"23/02/2006","USD",57643000,2006-02-23
"170","Distrito Federal","Estados","DF","BID","Organismos Multilaterais","Programa de Saneamento Básico do Distrito Federal
.",NA,"11/06/2001","USD",1.3e+08,2001-06-11
"171","Espirito Santo","Estados","ES","CAIXA","Bancos Federais","Repactuação Dívida FGTS",NA,"24/08/2018","R$",905518225.03,2018-08-24
"172","Espirito Santo","Estados","ES","BID","Organismos Multilaterais","Projeto Estado Presente",NA,"28/12/2017","USD",5.6e+07,2017-12-28
"173","Espirito Santo","Estados","ES","BIRD","Organismos Multilaterais","Programa de Gestão Integrada das Águas e da Paisagem",NA,"28/09/2015","USD",2.25e+08,2015-09-28
"174","Espirito Santo","Estados","ES","BNDES","Bancos Federais","Programa Estadual de Desenvolvimento Sustentável - PROEDES. Lei nº 9.874, de 13/07/2012",NA,"07/12/2012","R$",3e+09,2012-12-07
"175","Espirito Santo","Estados","ES","CAIXA","Bancos Federais","PROEDES - Programa Estadual de Desenvolvimento Sustentável",NA,"30/11/2012","R$",415559740.08,2012-11-30
"176","Espirito Santo","Estados","ES","BID","Organismos Multilaterais","Programa Rodoviário do Espírito Santo III",NA,"21/12/2011","USD",1.75e+08,2011-12-21
"177","Espirito Santo","Estados","ES","BID","Organismos Multilaterais","Plano de Desenvolvimento da Administração Fazendária - PROFAZ",NA,"05/11/2010","USD",21992000,2010-11-05
"178","Espirito Santo","Estados","ES","BNDES","Bancos Federais","Programas de Desenvolvimento Integrado Constantes do PPA. Descontingenciamento de Crédito - Resolução CMN nº 3.794, de 07/10/2009",NA,"20/05/2010","R$",9e+07,2010-05-20
"179","Espirito Santo","Estados","ES","BIRD","Organismos Multilaterais","Programa de Gerenciamento da Poluição Costeira e de Águas - Projetos Águas Limpas II",NA,"17/09/2009","USD",71500000,2009-09-17
"180","Espirito Santo","Estados","ES","BID","Organismos Multilaterais","Programa Rodoviário do Espírito Santo II",NA,"28/03/2006","USD",73500000,2006-03-28
"181","Espirito Santo","Estados","ES","BIRD","Organismos Multilaterais","Projeto de Gerenciamento da Poluição Costeira e de Águas do Espírito Santo - Projeto Águas Limpas",NA,"10/11/2004","USD",3.6e+07,2004-11-10
"182","Espirito Santo","Estados","ES","BID","Organismos Multilaterais","A definir",NA,"28/02/1992","USD",15600000,1992-02-28
"183","Goias","Estados","GO","CAIXA","Bancos Federais","Assunção da Dívida do Contrato nº 0412.113-76/2014",13,"02/08/2016","R$",1.9e+09,2016-08-02
"184","Goias","Estados","GO","BID","Organismos Multilaterais","Programa de Modernização da Administração Fazendária - PROFISCO.",NA,"23/08/2013","USD",11577000,2013-08-23
"185","Goias","Estados","GO","BB","Bancos Federais","Programas e projetos referidos na Lei nº 18.032, de 22/05/2013",2,"08/08/2013","R$",1.56e+09,2013-08-08
"186","Goias","Estados","GO","BNDES","Bancos Federais","Amortização de Dívida do Estado e Aporte de Capital para a SANEAGO. Lei nº 17.816, de 10/10/2012",12,"18/01/2013","R$",260416043.3,2013-01-18
"187","Goias","Estados","GO","CAIXA","Bancos Federais","PROINVESTE - Programa de Apoio ao Investimento dos Estados e Distrito Federal",12,"28/12/2012","R$",366969587.8,2012-12-28
"188","Goias","Estados","GO","BNDES","Bancos Federais","Construção e Manutenção de Rodovias Pavimentadas e não Pavimentadas e Adequação de Aeródromos. Lei nº 17.666, de 18/06/2012",9,"11/10/2012","R$",1.5e+09,2012-10-11
"189","Goias","Estados","GO","CAIXA","Bancos Federais","Saneamento da CELG-D",14,"27/12/2011","R$",3.527e+09,2011-12-27
"190","Maranhao","Estados","MA","BID","Organismos Multilaterais","Projeto de modernização da gestão fiscal do Estado do Maranhão - PROFISCO II - MA",NA,"21/02/2019","USD",3.5e+07,2019-02-21
"191","Maranhao","Estados","MA","BB","Bancos Federais","Programa Maranhão mais Justo e Competitivo II. Lei nº 10.546, de 23/12/2016",NA,"12/12/2017","R$",55692000,2017-12-12
"192","Maranhao","Estados","MA","CAIXA","Bancos Federais","Programa Maranhão Mais Justo e Competitivo",NA,"30/12/2016","R$",444750000,2016-12-30
"193","Maranhao","Estados","MA","BNDES","Bancos Federais","Linha de Financiamento BNDES Estados. Lei nº 9.711, de 01/11/2012",NA,"18/09/2013","R$",2799659479.61,2013-09-18
"194","Maranhao","Estados","MA","BOFA","Credores Privados","Financiamento da quitação do resíduo das dívidas constituídas (Leis Federais nºs 8727/93 e 9496/97)",1,"23/07/2013","USD",661967121.34,2013-07-23
"195","Maranhao","Estados","MA","BNDES","Bancos Federais","PROINVESTE - Programa de Apoio ao Investimento dos Estados e do Distrito Federal. Lei nº 9.711, de 01/11/2012",NA,"14/01/2013","R$",1001340520.39,2013-01-14
"196","Maranhao","Estados","MA","BID","Organismos Multilaterais","Projeto de Fortalecimento da Gestão Fiscal do Estado do Maranhão - PROFIS",NA,"29/09/2010","USD",13200000,2010-09-29
"197","Maranhao","Estados","MA","BNDES","Bancos Federais","Programas de Desenvolvimento Integrado Constantes do PPA. Descontingenciamento de Crédito - Resolução CMN nº 3.794, de 07/10/2009",NA,"26/06/2010","R$",433092000,2010-06-26
"198","Maranhao","Estados","MA","BIRD","Organismos Multilaterais","Programa de Combate à Pobreza Rural - PCPR II",1,"15/02/2006","USD",3e+07,2006-02-15
"199","Mato Grosso","Estados","MT","BIRD","Organismos Multilaterais","Empréstimo de Política de Desenvolvimento com Sustentabilidade Fiscal e Ambiental no Estado de Mato Grosso",NA,"06/09/2019","USD",2.5e+08,2019-09-06
"200","Mato Grosso","Estados","MT","BB","Bancos Federais","Programa de Restauração, Revitalização e Pavimentação de Rodovias. Lei nº 9.827, de 22/11/2012",NA,"27/10/2014","R$",1.3e+08,2014-10-27
"201","Mato Grosso","Estados","MT","BB","Bancos Federais","Programa PROCONCRETO (Pontes de Concreto) - Lei nº 9.828, de 22/11/2012",NA,"27/10/2014","R$",4.7e+08,2014-10-27
"202","Mato Grosso","Estados","MT","BB","Bancos Federais","Programa Mato Grosso Integrado, Sustentável e Competitivo. Lei nº 9.763, de 21/06/2012",NA,"27/12/2012","R$",1416670000,2012-12-27
"203","Mato Grosso","Estados","MT","BB","Bancos Federais","Programa de Apoio ao Investimento dos Estados e do Distrito Federal - PROINVESTE. Resolução nº 2.827, de 30/03/2001",NA,"27/12/2012","R$",460068420,2012-12-27
"204","Mato Grosso","Estados","MT","CAIXA","Bancos Federais","Programa de Aceleração do Crescimento - CPAC",NA,"27/12/2012","R$",727920000,2012-12-27
"205","Mato Grosso","Estados","MT","BID","Organismos Multilaterais","Programa de Desenvolvimento da Administração Fazendária - PROFISCO",NA,"20/12/2012","USD",15032000,2012-12-20
"206","Mato Grosso","Estados","MT","BOFA","Credores Privados","Reestruturação de parte das dívidas do Estado de Mato Grosso oriundas de leis federais",1,"10/09/2012","USD",478958330.51,2012-09-10
"207","Mato Grosso do Sul","Estados","MS","BID","Organismos Multilaterais","Projeto de Modernização da Gestão Fiscal do Estado de Mato Grosso do Sul - PROFISCO II - MS",NA,"16/09/2019","USD",47700000,2019-09-16
"208","Mato Grosso do Sul","Estados","MS","BNDES","Bancos Federais","Programa de Apoio ao Desenvolvimento Regional - PADR. Leis nº 4.243, de 22/08/2012, e nº 4.284, de 14/12/2012",2,"03/06/2013","R$",733500000,2013-06-03
"209","Mato Grosso do Sul","Estados","MS","BNDES","Bancos Federais","PROINVESTE - Programa de Apoio ao Investimento dos Estados e do Distrito Federal. Lei nº 4.243, de 22/08/2012",1,"28/12/2012","R$",357416000,2012-12-28
"210","Mato Grosso do Sul","Estados","MS","BID","Organismos Multilaterais","Programa de Modernização da Administração Tributária, Financeira e Patrimonial",NA,"29/10/2010","USD",1.2e+07,2010-10-29
"211","Mato Grosso do Sul","Estados","MS","BIRD","Organismos Multilaterais","Programa de Transportes e Desenvolvimento Sustentável do Estado (PDE/MS)",NA,"16/09/2010","USD",3e+08,2010-09-16
"212","Mato Grosso do Sul","Estados","MS","BNDES","Bancos Federais","Programas de Desenvolvimento Integrado Constantes do PPA. Descontingenciamento de Crédito - Resolução CMN nº 3.794, de 07/10/2009",NA,"16/07/2010","R$",79920000,2010-07-16
"213","Mato Grosso do Sul","Estados","MS","FONPLATA","Organismos Multilaterais","Projeto de Melhoria da Infra-Estrutura Viária da Região Sul Fronteira",NA,"04/07/2006","USD",2.8e+07,2006-07-04
"214","Minas Gerais","Estados","MG","CAIXA","Bancos Federais","Programa Saneamento para Todos",NA,"28/11/2013","R$",120887500,2013-11-28
"215","Minas Gerais","Estados","MG","CAIXA","Bancos Federais","Programa Saneamento para Todos",NA,"28/11/2013","R$",94254505.82,2013-11-28
"216","Minas Gerais","Estados","MG","CAIXA","Bancos Federais","Programa Saneamento para Todos",NA,"28/11/2013","R$",237500000,2013-11-28
"217","Minas Gerais","Estados","MG","BB","Bancos Federais","Programa de Infraestrutura Rodoviária. Lei nº 19.969, de 26/12/2011 e alterações",5,"24/07/2013","R$",1.5e+09,2013-07-24
"218","Minas Gerais","Estados","MG","CREDIT SUISSE","Credores Privados","Programa de Reestruturação da Dívida CRC-CEMIG",4,"28/12/2012","USD",1.3e+09,2012-12-28
"219","Minas Gerais","Estados","MG","BB","Bancos Federais","Programa de Desenvolvimento de Minas Gerais - PDMG - Lei nº 20.444, de 19/11/2012",5,"26/12/2012","R$",3653733000,2012-12-26
"220","Minas Gerais","Estados","MG","BNDES","Bancos Federais","PROINVESTE - Programa de Apoio ao Investimento dos Estados e do Distrito Federal. Lei nº 20.385, de 20/09/2012",6,"11/12/2012","R$",1326389531.69,2012-12-11
"221","Minas Gerais","Estados","MG","BNDES","Bancos Federais","Programa de Desenvolvimento Integrado II - PDI II. Lei nº 20.249, de 13/06/2012",16,"11/12/2012","R$",469773000,2012-12-11
"222","Minas Gerais","Estados","MG","AFD","Agências Governamentais","Programa de Apoio aos Investimentos em Infraestrutura de Serviços Básicos (CRC-CEMIG)",3,"03/12/2012","EUR",3e+08,2012-12-03
"223","Minas Gerais","Estados","MG","BIRD","Organismos Multilaterais","Terceiro Programa de Parceria para o Desenvolvimento de Minas Gerais",3,"26/11/2012","USD",4.5e+08,2012-11-26
"224","Minas Gerais","Estados","MG","BID","Organismos Multilaterais","Programa de Acesso ao Município - PROACESSO II",3,"30/09/2010","USD",5e+07,2010-09-30
"225","Minas Gerais","Estados","MG","BIRD","Organismos Multilaterais","Programa de Parceria para o Desenvolvimento de Minas Gerais II - Financiamento Adicional",3,"16/09/2010","USD",4.61e+08,2010-09-16
"226","Minas Gerais","Estados","MG","BID","Organismos Multilaterais","Programa de Parceria para o Desenvolvimento de Minas Gerais III",4,"08/07/2010","USD",1.37e+08,2010-07-08
"227","Minas Gerais","Estados","MG","BNDES","Bancos Federais","Programas de Desenvolvimento Integrado Constantes do PPA. Descontingenciamento de Crédito - Resolução CMN nº 3.794, de 07/10/2009",6,"29/06/2010","R$",267270000,2010-06-29
"228","Minas Gerais","Estados","MG","BID","Organismos Multilaterais","Programa de Eletrificação Rural - PRONOROESTE",3,"26/02/2010","USD",1e+07,2010-02-26
"229","Minas Gerais","Estados","MG","BID","Organismos Multilaterais","Projeto de Fortalecimento Institucional para Modernização da Gestão Fiscal -PROFORT-PROFISCO-MG",3,"26/02/2010","USD",4e+07,2010-02-26
"230","Minas Gerais","Estados","MG","BID","Organismos Multilaterais","Programa Consolidação das Cadeias Produtivas - Minas do Princípio ao Fim",3,"22/10/2009","USD",1e+07,2009-10-22
"231","Minas Gerais","Estados","MG","BIRD","Organismos Multilaterais","Programa de Parceria para o Desenvolvimento de Minas Gerais II",3,"13/08/2008","USD",9.76e+08,2008-08-13
"232","Minas Gerais","Estados","MG","BNB","Bancos Federais","Programa de Desenvolvimento do Turismo no Nordeste - PRODETUR/NE - II",3,"02/06/2006","R$",59966559.43,2006-06-02
"233","Minas Gerais","Estados","MG","BID","Organismos Multilaterais","Programa de Melhoria da Acessibilidade de Municípios de Pequeno Porte de MG - PROACESSO",3,"28/04/2006","USD",5e+07,2006-04-28
"234","Minas Gerais","Estados","MG","BIRD","Organismos Multilaterais","Programa de Ajuste Estrutural e de Políticas de Desenvolvimento do Estado",4,"28/04/2006","USD",1.7e+08,2006-04-28
"235","Minas Gerais","Estados","MG","BIRD","Organismos Multilaterais","Projeto de Combate à Pobreza Rural da Região Mineira do Nordeste - PCPR - 1ª Fase",3,"31/01/2006","USD",3.5e+07,2006-01-31
"236","Para","Estados","PA","CAIXA","Bancos Federais","Programa de Financiamento à Infraestrutura e ao Saneamento",NA,"04/03/2020","R$",537322634.96,2020-03-04
"237","Para","Estados","PA","NDB","Organismos Multilaterais","Programa Municípios Sustentáveis",NA,"11/03/2019","USD",5e+07,2019-03-11
"238","Para","Estados","PA","BID","Organismos Multilaterais","Projeto de Modernização da Gestão Fiscal do Estado do Pará - PROFISCO II - PA",NA,"19/02/2019","USD",35100000,2019-02-19
"239","Para","Estados","PA","CAF","Organismos Multilaterais","Programa Municípios Sustentáveis",NA,"19/02/2019","USD",5e+07,2019-02-19
"240","Para","Estados","PA","CAIXA","Bancos Federais","Programa de Investimento nas áreas de Saúde e de Infraestrutura e Logística",NA,"29/07/2017","R$",673900000,2017-07-29
"241","Para","Estados","PA","BID","Organismos Multilaterais","Programa da Melhoria da Qualidade e Expansão da Cobertura da Educação Básica",NA,"16/12/2013","USD",200810000,2013-12-16
"242","Para","Estados","PA","BNDES","Bancos Federais","PROINVESTE - Programa de Apoio ao Investimento dos Estados e do Distrito Federal. Lei nº 7.672, de 29/10/2012",NA,"28/12/2012","R$",955045575,2012-12-28
"243","Para","Estados","PA","JICA","Agências Governamentais","Projeto Ação Metrópole - 2ª Etapa",NA,"04/09/2012","JPY",1.6411e+10,2012-09-04
"244","Para","Estados","PA","BNDES","Bancos Federais","Programas de Desenvolvimento Integrado Constantes do PPA. Descontingenciamento de Crédito - Resolução CMN nº 3.794, de 07/10/2009",NA,"30/11/2010","R$",366720000,2010-11-30
"245","Para","Estados","PA","BID","Organismos Multilaterais","Programa de Apoio à Modernização e Transparência Fiscal  - PROGEFAZ.",NA,"28/09/2009","USD",1e+07,2009-09-28
"246","Para","Estados","PA","CAF","Organismos Multilaterais","Programa de Infraestrutura Rodoviária",NA,"08/07/2009","USD",8.5e+07,2009-07-08
"247","Para","Estados","PA","BIRD","Organismos Multilaterais","Programa Pará Rural",NA,"07/11/2007","USD",6e+07,2007-11-07
"248","Para","Estados","PA","UniCredit","Credores Privados","Prefabricated Road Bridges",NA,"18/07/2006","USD",42670000,2006-07-18
"249","Para","Estados","PA","BID","Organismos Multilaterais","Programa de Apoio ao PARÁ URBE - Primeira Fase",NA,"03/07/2002","USD",4.8e+07,2002-07-03
"250","Para","Estados","PA","BID","Organismos Multilaterais","A definir.",NA,"27/01/1993","USD",3e+07,1993-01-27
"251","Para","Estados","PA","BID","Organismos Multilaterais","A definir.",NA,"27/01/1993","USD",1.15e+08,1993-01-27
"252","Paraiba","Estados","PB","BIRD","Organismos Multilaterais","Projeto Paraíba Rural Sustentável",NA,"13/03/2019","USD",5e+07,2019-03-13
"253","Paraiba","Estados","PB","CAIXA","Bancos Federais","CPAC- Programa de Financiamento de Contrapartidas do Programa de Aceleração do Crescimento",1,"16/10/2013","R$",211570365.91,2013-10-16
"254","Paraiba","Estados","PB","BNDES","Bancos Federais","PROINVESTE - Programa de Apoio ao Investimento dos Estados e do Distrito Federal. Lei nº 9.873, de 15/08/2012",NA,"30/01/2013","R$",689222444.22,2013-01-30
"255","Paraiba","Estados","PB","BNDES","Bancos Federais","Programa Paraíba Sustentável. Lei nº 07/12/2011",NA,"09/11/2012","R$",5e+08,2012-11-09
"256","Paraiba","Estados","PB","FIDA","Organismos Multilaterais","Projeto de Desenvolvimento Sustentável do Cariri e Seridó - PROCASE",NA,"17/10/2012","SDR",16064876,2012-10-17
"257","Paraiba","Estados","PB","BID","Organismos Multilaterais","PROFISCO - Programa de Modernização Fiscal do Estado da Paraíba",NA,"18/05/2012","USD",7479000,2012-05-18
"258","Paraiba","Estados","PB","BNDES","Bancos Federais","Programas de Desenvolvimento Integrado Constantes do PPA. Descontingenciamento de Crédito - Resolução CMN nº 3.794, de 07/10/2009",NA,"13/09/2010","R$",287334000,2010-09-13
"259","Paraiba","Estados","PB","BIRD","Organismos Multilaterais","Projeto de Redução da Pobreza Rural - PRPR/COOPERAR",NA,"28/04/2010","USD",20900000,2010-04-28
"260","Paraiba","Estados","PB","CAF","Organismos Multilaterais","Programa de Pavimentação e Recuperação de Rodovias - Novos Caminhos",NA,"26/04/2010","USD",1e+08,2010-04-26
"261","Parana","Estados","PR","BID","Organismos Multilaterais","Programa de Apoio ao Desenvolvimento Urbano e Melhorias de Infraestrutura Municipal - Paraná Urbano III",NA,"16/04/2020","USD",118370000,2020-04-16
"262","Parana","Estados","PR","BID","Organismos Multilaterais","Programa Estratégico de Infraestrutura e Logística de Transportes do Paraná",NA,"20/12/2017","USD",2.35e+08,2017-12-20
"263","Parana","Estados","PR","BID","Organismos Multilaterais","Programa Paraná Seguro",NA,"12/01/2017","USD",67200000,2017-01-12
"264","Parana","Estados","PR","BID","Organismos Multilaterais","Programa de Gestão Fiscal do Estado do Paraná - PROFISCO",NA,"06/08/2014","USD",8500000,2014-08-06
"265","Parana","Estados","PR","BID","Organismos Multilaterais","Programa Integrado de Inclusão Social e Requalificação Urbana - Família Paranaense",NA,"06/08/2014","USD",6e+07,2014-08-06
"266","Parana","Estados","PR","BNDES","Bancos Federais","Repactuação, redução e quitação da dívida do BADEP, frente ao BNDES e FINAME",NA,"16/07/2014","R$",4e+08,2014-07-16
"267","Parana","Estados","PR","BB","Bancos Federais","Programa de Apoio ao Investimento dos Estados e do Distrito Federal - PROINVESTE. Resolução nº 2.827, de 30/03/2001",NA,"30/12/2013","R$",816831240.58,2013-12-30
"268","Parana","Estados","PR","BIRD","Organismos Multilaterais","Projeto Multissetorial  para o Desenvolvimento do Paraná",NA,"12/12/2013","USD",3.5e+08,2013-12-12
"269","Parana","Estados","PR","BID","Organismos Multilaterais","Paraná Urbano II",NA,"03/07/2002","USD",1e+08,2002-07-03
"270","Parana","Estados","PR","JICA","Agências Governamentais","Projeto de Saneamento Ambiental",NA,"08/01/1998","JPY",2.3686e+10,1998-01-08
"271","Parana","Estados","PR","BID","Organismos Multilaterais","Programa Expansão, Melhoria e Inovação no Ensino Médio - PROEM",NA,"23/12/1997","USD",1e+08,1997-12-23
"272","Pernambuco","Estados","PE","BID","Organismos Multilaterais","Projeto de Aperfeiçoamento da Gestão Fiscal do Estado de Pernambuco - PROFISCO II - PE",1,"30/09/2019","USD",3.7e+07,2019-09-30
"273","Pernambuco","Estados","PE","CAIXA","Bancos Federais","Financiamento de Plano de Investimento",1,"14/12/2017","R$",3.4e+08,2017-12-14
"274","Pernambuco","Estados","PE","BID","Organismos Multilaterais","Programa de Consolidação do Equilíbrio Fiscal para o Desenvolvimento Econômico e Social",NA,"17/12/2013","USD",4e+08,2013-12-17
"275","Pernambuco","Estados","PE","BID","Organismos Multilaterais","Programa de Saneamento Ambiental da Bacia do Rio Ipojuca - PSA",1,"07/08/2013","USD",2e+08,2013-08-07
"276","Pernambuco","Estados","PE","BIRD","Organismos Multilaterais","Programa de Desenvolvimento das Políticas Públicas II - DPL",1,"18/07/2013","USD",5.5e+08,2013-07-18
"277","Pernambuco","Estados","PE","BNDES","Bancos Federais","Linha de Financiamento BNDES Estados. Lei nº 14.607, de 30/03/2012, e nº 14.767, de 12/09/2012",1,"23/01/2013","R$",423613990,2013-01-23
"278","Pernambuco","Estados","PE","CAIXA","Bancos Federais","Programa de Financiamento à Infraestrutura e ao Saneamento - FINISA",1,"19/12/2012","R$",1069073425.71,2012-12-19
"279","Pernambuco","Estados","PE","BIRD","Organismos Multilaterais","Projeto Pernambuco Rural Sustentável",1,"18/06/2012","USD",1e+08,2012-06-18
"280","Pernambuco","Estados","PE","BIRD","Organismos Multilaterais","Programa de Desenvolvimento das Políticas Públicas",1,"13/04/2012","USD",5e+08,2012-04-13
"281","Pernambuco","Estados","PE","CAIXA","Bancos Federais","Programa de Financiamento de Contrapartidas do Programa de Aceleração do Crescimento - CPAC",NA,"31/10/2011","R$",299555874.16,2011-10-31
"282","Pernambuco","Estados","PE","BID","Organismos Multilaterais","Programa de Produção e Difusão de Inovações para a Competitividade de Arranjos Produtivos Locais -PROAPL",1,"20/06/2011","USD",1e+07,2011-06-20
"283","Pernambuco","Estados","PE","BID","Organismos Multilaterais","Programa Nacional do Turismo - PRODETUR NACIONAL",NA,"02/12/2010","USD",7.5e+07,2010-12-02
"284","Pernambuco","Estados","PE","BID","Organismos Multilaterais","Projeto de Apoio à Modernização e à Transparência da Gestão Fiscal",1,"13/07/2010","USD",1.5e+07,2010-07-13
